{
  "schema": "plinth.family_invite_preview/1",
  "inviter_first_name": "Rohan",
  "scope_line": "Aurelia Heights, Phase 2",
  "rera_number": "GGM/673/405/2022/117",
  "what_you_get": [
    "An alert when its band changes, a QPR is filed or missed, its date moves or an order is passed.",
    "A short round-up on Sundays. Nothing between 10 pm and 8 am.",
    "Stop anytime: reply STOP, or leave from this page."
  ],
  "number_line": "Rohan sees that you joined, never your number."
}
