{
  "schema": "plinth.family_invite_preview/1",
  "inviter_first_name": "Rohan",
  "scope_line": "4 projects: Aurelia Heights Ph 2, Kestrel Park, Sapphire Grove Ph 1 and Coral Towers",
  "rera_number": null,
  "what_you_get": [
    "An alert when a project's band changes, a QPR is filed or missed, its date moves or an order is passed.",
    "A short round-up on Sundays. Nothing between 10 pm and 8 am.",
    "Stop anytime: reply STOP, or leave from this page."
  ],
  "number_line": "Rohan sees that you joined, never your number."
}
