{
  "schema": "plinth.family_invite_preview/1",
  "inviter_first_name": "Rohan",
  "scope_line": "Aurelia Heights, Phase 2",
  "rera_number": "GGM/673/405/2022/117",
  "what_you_get": [
    "The same alerts as Rohan for Aurelia Heights, Phase 2",
    "Notes on the shared shortlist"
  ],
  "number_line": "Rohan sees that you joined, never your number."
}
